{"schema_version":1,"task_id":"7f1c2a9e-3b4d-4e5f-8a6b-1c2d3e4f5a6b","head_sha":"0123456789abcdef0123456789abcdef01234567","passed":true,"checks":[{"name":"typecheck","status":"PASS","duration_ms":4200,"artifact":null},{"name":"visual","status":"SKIP"}],"blocking_failures":[],"eligible_for_merge":true,"human_approval_required":false}
